{
  "schema": "jero-ai.review-last-event-closure/v1",
  "operation": "review.capture-correction-plan",
  "lineage_id": "review-afeed0d5a9aa24a1",
  "target_identity": "sha256:ccbd92bd891a944ceeb21be0982a5f0dc515ed94a0f15da0a64d21608329aa59",
  "request_hash": "sha256:0f6dd21a64f76566fdcd8c8f4e87157e1658d207798c2dbd1510d7001af9d243",
  "correction_lines": 2,
  "state": "correction_required",
  "store_revision": "sha256:5a5d22f4f65b0adeca5e2c3a3da0509ced6197a067aa7ffe4b9b040acad4194e"
}
